<xs:schema xmlns:xs="http://www.w3.org/2001/XMLSchema">
    <xs:element name="discos">
        <xs:complexType>
            <xs:sequence>
                <xs:element name="grupo" minOccurs="0" maxOccurs="unbounded" >
                    <xs:complexType>
                        <xs:sequence>
                            <xs:element name="nombre">
                                <xs:simpleType>
                                    <xs:restriction base="xs:string">
                                        <xs:maxLength value="50"></xs:maxLength>
                                    </xs:restriction>
                                </xs:simpleType>
                            </xs:element>
                            <xs:element name="miembro" minOccurs="0" maxOccurs="4">
                                <xs:simpleType>
                                    <xs:restriction base="xs:string">
                                        <xs:maxLength value="50"></xs:maxLength>
                                    </xs:restriction>
                                </xs:simpleType>
                            </xs:element>
                            <xs:element name="nacionalidad" minOccurs="0" maxOccurs="unbounded">
                                <xs:simpleType>
                                    <xs:restriction base="xs:string">
                                        <xs:maxLength value="50"></xs:maxLength>
                                    </xs:restriction>
                                </xs:simpleType>
                            </xs:element>
                        </xs:sequence>
                        <xs:attribute name="nom" type="xs:ID" ></xs:attribute>
                    </xs:complexType>
                </xs:element>
                <xs:element name="disco" minOccurs="0" maxOccurs="unbounded" >
                    <xs:complexType>
                        <xs:sequence>
                            <xs:element name="interprete">
                                <xs:complexType>
                                    <xs:attribute name="nom" type="xs:IDREFS" ></xs:attribute>
                                </xs:complexType>
                            </xs:element>
                            <xs:element name="titulo">
                                <xs:simpleType>
                                    <xs:restriction base="xs:string">
                                        <xs:maxLength value="50"></xs:maxLength>
                                    </xs:restriction>
                                </xs:simpleType>
                            </xs:element>
                            <xs:element name="discografica" default="CBS" minOccurs="0" maxOccurs="unbounded" >
                                <xs:simpleType>
                                    <xs:restriction base="xs:string">
                                        <xs:maxLength value="50"></xs:maxLength>
                                        <xs:enumeration value="Sony"></xs:enumeration>
                                        <xs:enumeration value="CBS"></xs:enumeration>
                                        <xs:enumeration value="SIRE"></xs:enumeration>
                                        <xs:enumeration value="OTRAS"></xs:enumeration>
                                    </xs:restriction>
                                </xs:simpleType>
                            </xs:element>
                            <xs:element name="anio" minOccurs="0" maxOccurs="10" >
                                <xs:complexType>
                                    <xs:simpleContent>
                                        <xs:extension base="xs:integer">
                                            <xs:attribute name="mes">
                                                <xs:simpleType>
                                                    <xs:restriction base="xs:string">
                                                        <xs:maxLength value="50"></xs:maxLength>
                                                    </xs:restriction>
                                                </xs:simpleType>
                                            </xs:attribute>
                                        </xs:extension>
                                    </xs:simpleContent>
                                </xs:complexType>
                            </xs:element>
                            <xs:element name="stock">
                                <xs:simpleType>
                                    <xs:restriction base="xs:integer">
                                        <xs:minInclusive value="0"></xs:minInclusive>
                                        <xs:maxInclusive value="200"></xs:maxInclusive>
                                    </xs:restriction>
                                </xs:simpleType>
                            </xs:element>
                        </xs:sequence>
                        <xs:attribute name="precio">
                            <xs:simpleType>
                                <xs:restriction base="xs:decimal">
                                    <xs:fractionDigits value="2"></xs:fractionDigits>
                                </xs:restriction>
                            </xs:simpleType>
                        </xs:attribute>
                    </xs:complexType>
                </xs:element>
            </xs:sequence>
        </xs:complexType>
    </xs:element>
</xs:schema>